{
  "schema_version": 1,
  "id": "restore-per-project-socrates-orchestrator-entry-point",
  "title": "Restore per-project Socrates orchestrator entry point",
  "work_class": "planned",
  "status": "active",
  "tracker": {
    "provider": "none",
    "reference": null,
    "url": null
  },
  "workflow": {
    "schema_version": 1,
    "spec_revision": 1,
    "plan_revision": 1
  }
}
